Key,Summary,solution,Solution_team,Solution_component,Description
VMTAS-96225,Unused jobs get deployed & enabled during official deployment process,"If you have any questions regarding the CI pipeline job, please visit https://eteamspace.internal.ericsson.com/pages/viewpage.action?pageId=1009149458 page or reach out to a CI team member.",Euphoria,CIFW,Unused jobs get deployed & enabled during official deployment process
VMTAS-95607,NFL#1997 || NST and NFT results not available due to EnvironmentError: HTTPSConnectionPool(host='arm.sero.gic.ericsson.se' port=443)(Caused by ResponseError('too many 503 error responses')),"It seems there is a connection issue with Artifactory. This might be a temporary problem. However, if it persists across multiple builds, please raise a ticket with CIFW for further investigation.",Euphoria,CIFW,"NFL#1997 || NST and NFT results not available due to EnvironmentError: HTTPSConnectionPool(host='arm.sero.gic.ericsson.se', port=443),(Caused by ResponseError('too many 503 error responses')) {code:java} [CIFW][INFO] Upgrading pip... Could not install packages due to an EnvironmentError: HTTPSConnectionPool(host='arm.sero.gic.ericsson.se', port=443): Max retries exceeded with url: /artifactory/api/pypi/pypi-remote/simple/pip/ (Caused by ResponseError('too many 503 error responses')) [CIFW][INFO] pip install failed using ARM PyPi, falling back to default PyPi ERROR: Could not find a version that satisfies the requirement certifi (from versions: none) ERROR: No matching distribution found for certifi [CIFW][INFO] Installing dependencies... ERROR: Could not find a version that satisfies the requirement cryptography==3.3.2 (from versions: none) ERROR: No matching distribution found for cryptography==3.3.2 *Could not install packages due to an EnvironmentError: HTTPSConnectionPool(host='arm.sero.gic.ericsson.se', port=443): Max retries exceeded with url: /artifactory/api/pypi/pypi-remote/simple/pip/ (Caused by ResponseError('too many 503 error responses'))*"
VMTAS-95316,SFL#12332|| Ova build failed due to Connection refused from RTID server,"It seems there is a connection issue with the RTID server, which could be a temporary problem. Please wait for some time or try retriggering the build. If the issue persists across multiple builds, please raise a ticket with CIFW for further investigation.",Euphoria,CIFW,*OBSERVATION/ERROR:* Connection refused from RTID server. [28521]: fatal error: /local/scratch/mtasbin/slave/workspace/develop_SFL/mtas/tas/mtas_code/CommonUtilitiesFW/src/CommonUtilitiesFW_SA/ServicesUtilities_SE/BlocklistSubscription_OB/CmcoIcmpSubscriptionApiImpl_SWI/spec/MtasIcmpBlocklistSubscriberApi.delos:1:22: error querying RTID from server for MtasIcmpBlocklistSubscriberApi: Trouble: [Errno 111] Connection refused [28521]:
VMTAS-94703,"CD loop || Node setup failing due error ""connection broken by 'NewConnectionError('<urllib3.connection.VerifiedHTTPSConnection object at 0x7ff7d79e4a90>: Failed to establish a new connection: [Errno -3] Temporary failure in name resolution')""","This issue might be related to a recent Python upgrade. Additionally, check if Artifactory is accessible and verify where the required version is being read from. For further investigation, please contact the CIFW team.",Euphoria,CIFW,All jobs are failing at node setup with the error below: {code:java}
VMTAS-94299,CFl job (pipeline_PREWASH_STFW_CFL) is failing for STFW commit validation,"If the issue is occurring for specific changes while other builds are working fine, please verify your changes. As a next step, you can retrigger the build to rule out any intermittent issues. If you encounter any Git-related problems or connection/permission issues in the logs, please raise a ticket with CIFW for further investigation.",Euphoria,CIFW,"Error Details: Triggered by Gerrit:  startup failed:WorkflowScript: 61: expecting '}', found ',' @ line 61, column 18.                   },                    ^ 1 error at org.codehaus.groovy.control.ErrorCollector.failIfErrors(ErrorCollector.java:309) at org.codehaus.groovy.control.ErrorCollector.addFatalError(ErrorCollector.java:149) at org.codehaus.groovy.control.ErrorCollector.addError(ErrorCollector.java:119) at org.codehaus.groovy.control.ErrorCollector.addError(ErrorCollector.java:131) at org.codehaus.groovy.control.SourceUnit.addError(SourceUnit.java:349) at org.codehaus.groovy.antlr.AntlrParserPlugin.transformCSTIntoAST(AntlrParserPlugin.java:225) at org.codehaus.groovy.antlr.AntlrParserPlugin.parseCST(AntlrParserPlugin.java:191) at org.codehaus.groovy.control.SourceUnit.parse(SourceUnit.java:233) at org.codehaus.groovy.control.CompilationUnit$1.call(CompilationUnit.java:189) at org.codehaus.groovy.control.CompilationUnit.applyToSourceUnits(CompilationUnit.java:966) at org.codehaus.groovy.control.CompilationUnit.doPhaseOperation(CompilationUnit.java:626) at org.codehaus.groovy.control.CompilationUnit.processPhaseOperations(CompilationUnit.java:602) at org.codehaus.groovy.control.CompilationUnit.compile(CompilationUnit.java:579) at groovy.lang.GroovyClassLoader.doParseClass(GroovyClassLoader.java:323) at groovy.lang.GroovyClassLoader.parseClass(GroovyClassLoader.java:293) at org.jenkinsci.plugins.scriptsecurity.sandbox.groovy.GroovySandbox$Scope.parse(GroovySandbox.java:163) at org.jenkinsci.plugins.workflow.cps.CpsGroovyShell.doParse(CpsGroovyShell.java:142) at org.jenkinsci.plugins.workflow.cps.CpsGroovyShell.reparse(CpsGroovyShell.java:127) at org.jenkinsci.plugins.workflow.cps.CpsFlowExecution.parseScript(CpsFlowExecution.java:561) at org.jenkinsci.plugins.workflow.cps.CpsFlowExecution.start(CpsFlowExecution.java:513) at org.jenkinsci.plugins.workflow.job.WorkflowRun.run(WorkflowRun.java:335) at hudson.model.ResourceController.execute(ResourceController.java:101) at hudson.model.Executor.run(Executor.java:442)Finished: FAILURE"
VMTAS-93122,fem30s10 not working as expected after upgrade,"If FEM is inaccessible, first confirm whether any upgrades or planned activities were scheduled. If none were planned, it could be a temporary issue. FEM might also go down unexpectedly due to high memory usage. If no clear cause is identified, please raise a ticket with CIFW for further investigation.",Euphoria,CIFW,fem30s10 not working as expected after upgrade
VMTAS-92242,fem30s10 is unreachable after upgrade,"If FEM is inaccessible, first confirm whether any upgrades or planned activities were scheduled. If none were planned, it could be a temporary issue. FEM might also go down unexpectedly due to high memory usage. If no clear cause is identified, please raise a ticket with CIFW for further investigation.",Euphoria,CIFW,fem30s10 is unreachable after upgrade
VMTAS-90905,SFL#11705|| LOTC Memory Usage alarm observed in outstanding table,This issue is related to MTAS or STFW. Kindly connect with these teams.,Gladitor,JCAT,*OBSERVATION/ERROR:* LOTC Memory Usage alarm observed in outstanding table. {code:java}
VMTAS-90309,Unable to find zip resource: 'jcatLogs/csvRaw in test case,"There is something wrong in file structure that you are trying to upload on Artifactory. Please verify the file structure. For more, discuss with team who are creating this file. If nothing works please raise a ticket to CIFW",Euphoria,CIFW,Unable to find zip resource: 'jcatLogs/csvRaw in test case
VMTAS-88537,Facing resource crunch issue in RNFL 1.29 #04 Stability Upgrade and Reins update test,"If builds are failing due to resource unavailability on the POD for an extended period, please reach out to CIFW for further investigation and resolution. On your end, you can check POD utilization on https://arm.sero.gic.ericsson.se/artifactory/proj-mtas-prototype-staging-local/production/Track_STC_Resources/resources_data.htmland the created stack at this link and delete any unused stacks if necessary.",Euphoria,CIFW,we are facing resource crunches issue in RNFL 1.29 #4 in stability upgrade and rein stance  upgrade .
VMTAS-88139,WEL jobs are getting failed,"If WEL is failing due to an FT test case failure, please raise a ticket with the FTFW team. Otherwise, the failure might be caused by the unavailability of Nomad executors or a connection issue with a server. These issues could be temporary, so wait for some time and retrigger the build. If the issue persists, please raise a ticket with the CIFW team.",Euphoria,CIFW,*OBSERVATION/ERROR:*  Timed out error
VMTAS-88086,FuncTest-Verification Execution failed in RNFL 1.25#92,"If there is a FT test case execution failure, please raise a ticket with the FTFW team. Otherwise, the failure might be caused by the unavailability of Nomad executors or a connection issue with a server. These issues could be temporary, so wait for some time and retrigger the build. If the issue persists, please raise a ticket with the CIFW team.",Euphoria,CIFW,FuncTest-Verification Execution failed in RNFL 1.25#92
VMTAS-86838,[CIFW][WARN] Precheck failed: filebeat on fem25,"If a job is not starting on a specific Sero machine, rebooting the machine might resolve the issue. Alternatively, any configuration issues can be addressed by the CIFW team. Additionally, please ensure that erroneous Sero machines are not being used in any other FEM.",Euphoria,CIFW,We are constantly facing the following problem on fem25.
VMTAS-85956,CT build failed for RNFL 1.26 #44 and #45,"Kindly check the logs for any connection issues, as these may be temporary. If that's the case, please try again after some time. For any permission or configuration issues, please contact CIFW. If there is a problem with component test case execution, please reach out to SWCM.",SWCM,SWCM,CT build failed for RNFL 1.26 #44 and #45
VMTAS-85851,SFL# 10928 FT failing at Setup,"Compare the commits with the last successful build, as any unmatched or recent commits may be the cause of the issue. Check the failed logs to identify the component linked to the error statement and reach out to the respective component team. If the issue persists, please raise a ticket with CIFW for further assistance.",CIFW,CIFW,"[FTFW][INFO][,597] Importing psycopg2 [FTFW][CRITICAL][,662] Can't find Flow [FTFW][INFO][,983] Start time: [FTFW][INFO][,984] Importing psycopg2 [FTFW][CRITICAL][,051] Can't find Flow [FTFW][INFO][,463] Start time: [FTFW][INFO][,463] Importing psycopg2 [FTFW][CRITICAL][,536] Can't find Flow [FTFW][INFO][,857] Start time: [FTFW][INFO][,858] Importing psycopg2 [FTFW][CRITICAL][,928] Can't find Flow [CIFW][INFO] LONG-DURATION TC scope supported [FTFW][INFO][,247] Importing psycopg2 [FTFW][CRITICAL][,314] Can't find Flow [CIFW][INFO] Generating db_execution_list.lst..."
VMTAS-85660,RC-Build CBA failed in RNFL 1.25 #83,"Please review the logs of the failed stage. If the MTAS build is failing, there may be an issue with the MTAS commit. You can compare the commits with the last successful build and raise a ticket with MTAS. For Midas errors, you can raise a SWCM ticket.",SWCM,SWCM,"RuntimeError: Building MTAS failed [ERROR  ][18:31:22] Critical step failed, execution should be stopped until the issue is corrected. [WARNING][18:31:22] Not all steps were completely successful, please check the logs to see if manual corrections are required! [ERROR  ][18:31:22] Critical step failed, execution should be stopped until the issue is corrected. [WARNING][18:31:22] Not all steps were completely successful, please check the logs to see if manual corrections are required! [INFO   ][18:31:22] Report saved to /local/scratch/mtasbin/slave/workspace/release_1.25_RNFL/MIDAS_2022_10_20_18_04_04/MIDAS_REPORT_2022_10_20_18_31_22"
VMTAS-85369,SFL#10848 || FT testcase Skipped although Verdict is Passed,"The issue might be due to a Nomad connection problem or insufficient Nomad executors, especially if many jobs or priority jobs are running. This could be a temporary issue, so please try retriggering the build after some time. If the problem persists, please raise a ticket with CIFW for further investigation.",Euphoria,CIFW,*OBSERVATION/ERROR:* FT testcase Skipped although Verdict is Passed. |STAGE|COMMENT|DURATION|START TIME|RAW LOG|TOTAL|PASSED|{color:#ffab00}*SKIPPED*{color}|FAILED|LINKS|
VMTAS-85368,SFL#10848 || FT testcase Skipped although Verdict is Passed,"The issue might be due to a Nomad connection problem or insufficient Nomad executors, especially if many jobs or priority jobs are running. This could be a temporary issue, so please try retriggering the build after some time. If the problem persists, please raise a ticket with CIFW for further investigation.",Euphoria,CIFW,*OBSERVATION/ERROR:* FT testcase Skipped although Verdict is Passed. |STAGE|COMMENT|DURATION|START TIME|RAW LOG|TOTAL|PASSED|{color:#ffab00}*SKIPPED*{color}|FAILED|LINKS|
VMTAS-84308,LSV 225 || Logs are not accessible for MMT_NA_BIN 48h.,It seems due to some memory issue logs were not available. please raise a tciket to CIFW if any build logs are not available,Euphoria,CIFW,Generating html report... Exception in Test Case: (OutOfMemoryError: Java heap space) java.lang.OutOfMemoryError: Java heap space
VMTAS-81672,LSV_214 : Unable to instantiate nodes on older tracks viz. 1.25 & below,"Compare the commits from the last successful build, as any differences could be the cause of the issue. Additionally, review the logs of the failed stage, identify the component associated with the error message, and raise a ticket with the respective component team. If the issue is related to the CI pipeline, please raise a ticket with CIFW.",Coyotes,WF,*OBSERVATION/ERROR:* Job skipped at Node Instantiation stage itself *Error Prints :* [ load() missing 1 required positional argument: 'Loader' [3854] Failed to execute script 'script_bundle' due to unhandled exception! Traceback (most recent call last):
VMTAS-109012, stability failed, Please check the logs for any connection issues as they might be temporary. You can try retriggering the build to resolve them. For test case failures contact the JCAT team. If the problem is related to configuration or permission changes or if it impacts all builds please raise a ticket with CIFW., MTAS_Euphoria, JCAT, MTAS failed to meet one or several evalution criterias defined in the test instruction. See test report page for more information. StatusConsoleListener Script support is not enabled. StatusConsoleListener File contains an invalid element or attribute "filePattern"
